{
  "$schema": "https://json-schema.org/draft/2020-12/schema",
  "$id": "https://github.com/basemode/basemode-evidence/schemas/contribution-v1.schema.json",
  "title": "basemode evidence contribution bundle v1",
  "type": "object",
  "additionalProperties": false,
  "required": [
    "schema_version", "bundle_id", "generated_at", "basemode_version",
    "window_start", "window_end", "observations"
  ],
  "properties": {
    "schema_version": {"const": 1},
    "bundle_id": {
      "type": "string",
      "format": "uuid",
      "pattern": "^[0-9a-f]{8}-[0-9a-f]{4}-[1-8][0-9a-f]{3}-[89ab][0-9a-f]{3}-[0-9a-f]{12}$"
    },
    "generated_at": {"$ref": "#/$defs/timestamp"},
    "basemode_version": {"$ref": "#/$defs/version"},
    "window_start": {"$ref": "#/$defs/timestamp"},
    "window_end": {"$ref": "#/$defs/timestamp"},
    "observations": {
      "type": "array",
      "minItems": 1,
      "maxItems": 1000,
      "items": {"$ref": "#/$defs/observation"}
    }
  },
  "$defs": {
    "timestamp": {
      "type": "string",
      "format": "date-time",
      "pattern": "^\\d{4}-\\d{2}-\\d{2}T\\d{2}:\\d{2}:\\d{2}(?:\\.\\d+)?Z$",
      "maxLength": 32
    },
    "version": {
      "type": "string",
      "minLength": 1,
      "maxLength": 64,
      "pattern": "^[0-9A-Za-z][0-9A-Za-z._+-]*$"
    },
    "identifier": {
      "type": "string",
      "minLength": 1,
      "maxLength": 128,
      "pattern": "^[a-z0-9~][a-z0-9._+~-]*(?:[:/][a-z0-9._+~-]+)*$"
    },
    "count": {"type": "integer", "minimum": 0, "maximum": 9007199254740991},
    "metric": {
      "type": "object",
      "additionalProperties": false,
      "required": ["count", "p50", "p95"],
      "properties": {
        "count": {"$ref": "#/$defs/count"},
        "p50": {"type": "number", "minimum": 0},
        "p95": {"type": "number", "minimum": 0}
      }
    },
    "failures": {
      "type": "object",
      "additionalProperties": false,
      "properties": {
        "authentication": {"$ref": "#/$defs/count"},
        "quota": {"$ref": "#/$defs/count"},
        "rate_limit": {"$ref": "#/$defs/count"},
        "timeout": {"$ref": "#/$defs/count"},
        "network": {"$ref": "#/$defs/count"},
        "provider_unavailable": {"$ref": "#/$defs/count"},
        "invalid_request": {"$ref": "#/$defs/count"},
        "empty_response": {"$ref": "#/$defs/count"},
        "content_filter": {"$ref": "#/$defs/count"},
        "provider_error": {"$ref": "#/$defs/count"},
        "cancelled": {"$ref": "#/$defs/count"},
        "unknown": {"$ref": "#/$defs/count"}
      }
    },
    "observation": {
      "type": "object",
      "additionalProperties": false,
      "required": [
        "endpoint", "strategy", "source", "operations", "successful_operations",
        "initial_attempts", "successful_initial_attempts", "recovered_operations",
        "attempts", "failures"
      ],
      "properties": {
        "endpoint": {"$ref": "#/$defs/identifier"},
        "strategy": {"$ref": "#/$defs/identifier"},
        "source": {
          "enum": ["cli", "python", "server", "loom", "verification"]
        },
        "source_version": {"$ref": "#/$defs/version"},
        "operations": {"$ref": "#/$defs/count"},
        "successful_operations": {"$ref": "#/$defs/count"},
        "initial_attempts": {"$ref": "#/$defs/count"},
        "successful_initial_attempts": {"$ref": "#/$defs/count"},
        "recovered_operations": {"$ref": "#/$defs/count"},
        "attempts": {"$ref": "#/$defs/count"},
        "failures": {"$ref": "#/$defs/failures"},
        "latency_ms": {"$ref": "#/$defs/metric"},
        "ttft_ms": {"$ref": "#/$defs/metric"},
        "input_tokens": {"$ref": "#/$defs/count"},
        "output_tokens": {"$ref": "#/$defs/count"},
        "cost_usd": {"type": "number", "minimum": 0}
      }
    }
  }
}
